{
  "version": "1",
  "vendors": {
    "openai": {
      "displayName": "OpenAI",
      "billingModel": "mixed",
      "docsUrl": "https://platform.openai.com/docs/models",
      "cookbookUrl": "https://cookbook.openai.com"
    },
    "anthropic": {
      "displayName": "Anthropic",
      "billingModel": "subscription_cli",
      "docsUrl": "https://docs.anthropic.com/claude/docs/models-overview"
    },
    "google": {
      "displayName": "Google (Antigravity)",
      "billingModel": "oauth_cli",
      "docsUrl": "https://antigravity.google"
    }
  },
  "models": [
    {
      "id": "gpt-5.5",
      "vendor": "openai",
      "modelFamily": "gpt-5.5",
      "displayName": "GPT-5.5",
      "status": "planned",
      "tier": 4,
      "roles": ["llm_analyze", "llm_cross_critique", "llm_agent_edit"],
      "modalities": ["text", "vision", "multimodal"],
      "presetDefault": "deep",
      "prompting": {
        "style": "structured",
        "approach": "outcome_first",
        "platformGuideUrl": "https://developers.openai.com/api/docs/guides/prompt-guidance/gpt-5.5.md",
        "platformGuideModel": "gpt-5.5",
        "guidanceTopics": [
          "personality-behavior",
          "preamble-streaming",
          "outcome-first-stopping",
          "formatting-verbosity",
          "retrieval-budget-citations",
          "creative-guardrails",
          "frontend-quality",
          "validation-loops",
          "assistant-phase"
        ],
        "notes": "Shorter outcome-first prompts vs GPT-5.4 stacks; re-evaluate low/medium effort before escalating."
      },
      "capabilities": {
        "reasoning": "frontier",
        "toolUse": true,
        "toolSearch": true,
        "computerUse": true,
        "compaction": false,
        "multimodal": true,
        "spatialReasoning": true,
        "japaneseQuality": "good",
        "codegen": true,
        "longWorkflow": true
      },
      "builtinTools": {
        "mcp": true,
        "computerUse": true,
        "webSearch": true,
        "fileSearch": true,
        "customTool": true
      },
      "apiFeatures": {
        "supportedEndpoints": ["responses_api", "chat_completions"],
        "recommendedEndpoint": "responses_api",
        "reasoningEffort": {
          "supported": true,
          "values": ["none", "minimal", "low", "medium", "high", "xhigh"],
          "default": "medium"
        },
        "verbosity": {
          "supported": true,
          "values": ["low", "medium", "high"],
          "default": "medium"
        },
        "structuredOutputs": true,
        "reasoningItems": true,
        "promptCaching": {
          "supported": true,
          "maxTtlHours": 24,
          "notes": "24h TTL only per platform guidance"
        },
        "parallelToolCalls": true,
        "freeFormFunctionCalling": true,
        "contextFreeGrammar": true,
        "skillsApi": true,
        "assistantPhase": {
          "supported": true,
          "values": ["commentary", "final_answer"]
        }
      },
      "limits": {
        "contextTokens": 272000,
        "pricingContextNote": "<272K context length (pricing tier)"
      },
      "apiPricing": {
        "currency": "USD",
        "unit": "per_1m_tokens",
        "lastReviewed": "2026-06-18",
        "pricingUrl": "https://developers.openai.com/api/docs/pricing",
        "standard": { "inputUsd": 5, "cachedInputUsd": 0.5, "outputUsd": 30 },
        "batch": { "inputUsd": 2.5, "cachedInputUsd": 0.25, "outputUsd": 15 },
        "flex": { "inputUsd": 2.5, "cachedInputUsd": 0.25, "outputUsd": 15 },
        "priority": { "inputUsd": 12.5, "cachedInputUsd": 1.25, "outputUsd": 75 }
      },
      "transport": {
        "invocationTypes": ["responses_api", "codex_cli"],
        "preferredInvocation": "responses_api",
        "apiSurface": "responses_api",
        "nativeModelFlag": "gpt-5.5",
        "invocationBindingRef": "openai:responses-v1"
      },
      "references": [
        {
          "type": "cookbook",
          "slug": "grounded-spatial-reasoning-layouts",
          "title": "Evaluating Grounded Spatial Reasoning with GPT-5.5",
          "url": "https://cookbook.openai.com/examples/multimodal/grounded_spatial_reasoning_layouts",
          "lastReviewed": "2026-06-18"
        },
        {
          "type": "cookbook",
          "slug": "reasoning-items",
          "title": "Better performance from reasoning models using the Responses API",
          "url": "https://cookbook.openai.com/examples/responses_api/reasoning_items",
          "lastReviewed": "2026-06-18"
        },
        {
          "type": "cookbook",
          "slug": "mcp-tool-guide",
          "title": "MCP Tool Guide",
          "url": "https://cookbook.openai.com/examples/mcp/mcp_tool_guide",
          "lastReviewed": "2026-06-18"
        },
        {
          "type": "platform_docs",
          "title": "GPT-5.5 Prompt guidance",
          "slug": "prompt-guidance",
          "url": "https://developers.openai.com/api/docs/guides/prompt-guidance",
          "lastReviewed": "2026-06-18"
        },
        {
          "type": "pricing",
          "url": "https://openai.com/api/pricing/"
        }
      ],
      "costHint": "flagship",
      "notes": "Flagship general model — complex reasoning, tools, long workflows. Prefer Responses API. Prompt: outcome-first (platform guide)."
    },
    {
      "id": "gpt-5.5-pro",
      "vendor": "openai",
      "modelFamily": "gpt-5.5",
      "displayName": "GPT-5.5 Pro",
      "status": "planned",
      "tier": 5,
      "roles": ["llm_aggregate", "llm_cross_critique"],
      "modalities": ["text", "multimodal"],
      "presetDefault": "critical",
      "prompting": {
        "style": "structured",
        "approach": "outcome_first",
        "platformGuideUrl": "https://developers.openai.com/api/docs/guides/prompt-guidance/gpt-5.5.md",
        "platformGuideModel": "gpt-5.5",
        "guidanceTopics": [
          "outcome-first-stopping",
          "formatting-verbosity",
          "validation-loops",
          "assistant-phase"
        ]
      },
      "capabilities": {
        "reasoning": "frontier",
        "toolUse": true,
        "longWorkflow": true,
        "multimodal": true
      },
      "builtinTools": {
        "mcp": true,
        "customTool": true
      },
      "apiFeatures": {
        "supportedEndpoints": ["responses_api"],
        "recommendedEndpoint": "responses_api",
        "reasoningEffort": {
          "supported": true,
          "values": ["medium", "high"],
          "default": "high"
        },
        "structuredOutputs": true,
        "reasoningItems": true,
        "assistantPhase": {
          "supported": true,
          "values": ["commentary", "final_answer"]
        },
        "promptCaching": {
          "supported": true,
          "maxTtlHours": 24
        }
      },
      "transport": {
        "invocationTypes": ["responses_api"],
        "preferredInvocation": "responses_api",
        "apiSurface": "responses_api",
        "nativeModelFlag": "gpt-5.5-pro"
      },
      "references": [
        {
          "type": "cookbook",
          "slug": "reasoning-items",
          "url": "https://cookbook.openai.com/examples/responses_api/reasoning_items",
          "lastReviewed": "2026-06-18"
        },
        {
          "type": "platform_docs",
          "title": "GPT-5.5 Prompt guidance",
          "slug": "prompt-guidance",
          "url": "https://developers.openai.com/api/docs/guides/prompt-guidance",
          "lastReviewed": "2026-06-18"
        },
        {
          "type": "pricing",
          "url": "https://openai.com/api/pricing/"
        }
      ],
      "costHint": "frontier",
      "limits": {
        "contextTokens": 272000,
        "pricingContextNote": "<272K context length (pricing tier)"
      },
      "apiPricing": {
        "currency": "USD",
        "unit": "per_1m_tokens",
        "lastReviewed": "2026-06-18",
        "pricingUrl": "https://developers.openai.com/api/docs/pricing",
        "standard": { "inputUsd": 30, "outputUsd": 180 },
        "batch": { "inputUsd": 15, "outputUsd": 90 },
        "flex": { "inputUsd": 15, "outputUsd": 90 }
      },
      "notes": "Higher-compute tier above GPT-5.5 for hardest problems. Outcome-first prompting (platform guide)."
    },
    {
      "id": "gpt-5.4",
      "vendor": "openai",
      "modelFamily": "gpt-5.4",
      "displayName": "GPT-5.4",
      "status": "planned",
      "tier": 3,
      "roles": ["llm_analyze", "llm_agent_edit", "llm_cross_critique"],
      "modalities": ["text", "vision", "document", "multimodal"],
      "presetDefault": "balanced",
      "prompting": {
        "style": "structured",
        "approach": "balanced",
        "platformGuideUrl": "https://developers.openai.com/api/docs/guides/prompt-guidance/gpt-5.4.md",
        "platformGuideModel": "gpt-5.4",
        "guidanceTopics": [
          "output-contract",
          "follow-through-policy",
          "instruction-priority",
          "missing-context-gating",
          "formatting-verbosity",
          "validation-loops",
          "assistant-phase",
          "retrieval-budget-citations",
          "tool-persistence"
        ],
        "notes": "Output contracts + explicit completion criteria; preserve assistant phase on replay. Cost-effective vs GPT-5.5."
      },
      "capabilities": {
        "reasoning": "high",
        "toolUse": true,
        "toolSearch": true,
        "computerUse": true,
        "compaction": true,
        "multimodal": true,
        "documentUnderstanding": true,
        "longWorkflow": true,
        "codegen": true
      },
      "builtinTools": {
        "mcp": true,
        "computerUse": true,
        "webSearch": true,
        "fileSearch": true,
        "customTool": true
      },
      "apiFeatures": {
        "supportedEndpoints": ["responses_api", "chat_completions"],
        "recommendedEndpoint": "responses_api",
        "reasoningEffort": {